<?xml version="1.0" encoding="UTF-8"?>
<xs:schema xmlns:xs="http://www.w3.org/2001/XMLSchema">
    <xs:element name="contactos">
        <xs:complexType>
            <xs:sequence>
                <xs:element name="persona" maxOccurs="unbounded">
                    <xs:complexType>
                        <xs:sequence>
                            <xs:element name="nombre" type="xs:string"></xs:element>
                            <xs:element name="apellidos" type="xs:string"></xs:element>
                            <xs:element name="correo" type="xs:string"></xs:element>
                            <xs:element name="telefono" type="xs:integer"></xs:element>  
                            <xs:element name="direccion" type="xs:string"></xs:element>                            
                        </xs:sequence>
                        <xs:attribute name="genero">
                            <xs:simpleType >
                                <xs:restriction base="xs:string">
                                    <xs:enumeration value="O"></xs:enumeration>
                                    <xs:enumeration value="F"></xs:enumeration>
                                    <xs:enumeration value="M"></xs:enumeration>
                                </xs:restriction>
                            </xs:simpleType>
                        </xs:attribute>
                    </xs:complexType>
                </xs:element>
            </xs:sequence>
        </xs:complexType>
    </xs:element>
</xs:schema>